{
  "registry_version": "0.4.0",
  "metamodel_version": "0.5.0",
  "engine": "baseline-name-overlap/0.5",
  "mappings": [
    {
      "mapping_id": "PROP-0001",
      "source": {
        "id": "CAP-310",
        "type": "A1.BusinessCapability",
        "version": "1.0"
      },
      "relationship": "SUPPORTED_BY",
      "target": {
        "id": "SD-044",
        "type": "A2.ServiceDomain",
        "version": "1.0",
        "canonical_id": "BIAN-FRAUD-DETECTION"
      },
      "status": "proposed",
      "confidence": 0.7,
      "evidence": [
        "engine_rationale:shared terms ['alerts', 'fraud', 'transactions'] between 'Card Fraud Alerts' and 'Fraud Detection (synthetic selection)'"
      ],
      "rationale": "shared terms ['alerts', 'fraud', 'transactions'] between 'Card Fraud Alerts' and 'Fraud Detection (synthetic selection)'",
      "baseline_id": "ENGINE-RUN",
      "created_by": "baseline-name-overlap/0.5"
    },
    {
      "mapping_id": "PROP-0002",
      "source": {
        "id": "VS-CARD-USE",
        "type": "A1.ValueStream",
        "version": "1.0"
      },
      "relationship": "ALIGNED_TO",
      "target": {
        "id": "BS-FRAUD-ALERT",
        "type": "A2.BusinessScenario",
        "version": "1.0"
      },
      "status": "proposed",
      "confidence": 0.67,
      "evidence": [
        "engine_rationale:shared terms ['card', 'cardholder', 'transaction'] between 'Use Card Safely' and 'Suspicious card transaction alerted'"
      ],
      "rationale": "shared terms ['card', 'cardholder', 'transaction'] between 'Use Card Safely' and 'Suspicious card transaction alerted'",
      "baseline_id": "ENGINE-RUN",
      "created_by": "baseline-name-overlap/0.5"
    },
    {
      "mapping_id": "PROP-0003",
      "source": {
        "id": "VSS-01",
        "type": "A1.ValueStreamStage",
        "version": "1.0"
      },
      "relationship": "ALIGNED_TO",
      "target": {
        "id": "BS-FRAUD-ALERT",
        "type": "A2.BusinessScenario",
        "version": "1.0"
      },
      "status": "proposed",
      "confidence": 0.6,
      "evidence": [
        "engine_rationale:shared terms ['card'] between 'Present card' and 'Suspicious card transaction alerted'"
      ],
      "rationale": "shared terms ['card'] between 'Present card' and 'Suspicious card transaction alerted'",
      "baseline_id": "ENGINE-RUN",
      "created_by": "baseline-name-overlap/0.5"
    },
    {
      "mapping_id": "PROP-0004",
      "source": {
        "id": "VSS-02",
        "type": "A1.ValueStreamStage",
        "version": "1.0"
      },
      "relationship": "ALIGNED_TO",
      "target": {
        "id": "BS-FRAUD-ALERT",
        "type": "A2.BusinessScenario",
        "version": "1.0"
      },
      "status": "proposed",
      "confidence": 0.73,
      "evidence": [
        "engine_rationale:shared terms ['card', 'transaction'] between 'Score the transaction' and 'Suspicious card transaction alerted'"
      ],
      "rationale": "shared terms ['card', 'transaction'] between 'Score the transaction' and 'Suspicious card transaction alerted'",
      "baseline_id": "ENGINE-RUN",
      "created_by": "baseline-name-overlap/0.5"
    },
    {
      "mapping_id": "PROP-0005",
      "source": {
        "id": "VSS-03",
        "type": "A1.ValueStreamStage",
        "version": "1.0"
      },
      "relationship": "ALIGNED_TO",
      "target": {
        "id": "BS-FRAUD-ALERT",
        "type": "A2.BusinessScenario",
        "version": "1.0"
      },
      "status": "proposed",
      "confidence": 0.9,
      "evidence": [
        "engine_rationale:shared terms ['alert', 'card', 'cardholder'] between 'Alert the cardholder' and 'Suspicious card transaction alerted'"
      ],
      "rationale": "shared terms ['alert', 'card', 'cardholder'] between 'Alert the cardholder' and 'Suspicious card transaction alerted'",
      "baseline_id": "ENGINE-RUN",
      "created_by": "baseline-name-overlap/0.5"
    },
    {
      "mapping_id": "PROP-0006",
      "source": {
        "id": "SD-044",
        "type": "A2.ServiceDomain",
        "version": "1.0",
        "canonical_id": "BIAN-FRAUD-DETECTION"
      },
      "relationship": "REALIZED_BY",
      "target": {
        "id": "APP-FRAUD-ENGINE",
        "type": "A3.ApplicationComponent",
        "version": "4.2"
      },
      "status": "proposed",
      "confidence": 0.7,
      "evidence": [
        "engine_rationale:shared terms ['alerts', 'fraud', 'transactions'] between 'Fraud Detection (synthetic selection)' and 'Fraud Engine'"
      ],
      "rationale": "shared terms ['alerts', 'fraud', 'transactions'] between 'Fraud Detection (synthetic selection)' and 'Fraud Engine'",
      "baseline_id": "ENGINE-RUN",
      "created_by": "baseline-name-overlap/0.5"
    },
    {
      "mapping_id": "PROP-0007",
      "source": {
        "id": "SO-044-07",
        "type": "A2.ServiceOperation",
        "version": "1.0"
      },
      "relationship": "IMPLEMENTED_BY",
      "target": {
        "id": "POST /fraud/alerts",
        "type": "A3.APIOperation",
        "version": "3.1"
      },
      "status": "proposed",
      "confidence": 0.65,
      "evidence": [
        "engine_rationale:shared terms ['alert', 'fraud'] between 'Notify Fraud Alert' and 'Create fraud alert'"
      ],
      "rationale": "shared terms ['alert', 'fraud'] between 'Notify Fraud Alert' and 'Create fraud alert'",
      "baseline_id": "ENGINE-RUN",
      "created_by": "baseline-name-overlap/0.5"
    },
    {
      "mapping_id": "PROP-0008",
      "source": {
        "id": "APP-FRAUD-ENGINE",
        "type": "A3.ApplicationComponent",
        "version": "4.2"
      },
      "relationship": "DEPLOYED_ON",
      "target": {
        "id": "DEP-FRAUD-PROD",
        "type": "A4.Deployment",
        "version": "1.0"
      },
      "status": "proposed",
      "confidence": 0.69,
      "evidence": [
        "engine_rationale:shared terms ['engine', 'fraud'] between 'Fraud Engine' and 'Fraud Engine \u2014 production deployment'"
      ],
      "rationale": "shared terms ['engine', 'fraud'] between 'Fraud Engine' and 'Fraud Engine \u2014 production deployment'",
      "baseline_id": "ENGINE-RUN",
      "created_by": "baseline-name-overlap/0.5"
    },
    {
      "mapping_id": "PROP-0009",
      "source": {
        "id": "APP-FRAUD-ENGINE",
        "type": "A3.ApplicationComponent",
        "version": "4.2"
      },
      "relationship": "DEPLOYED_AS",
      "target": {
        "id": "DEP-FRAUD-PROD",
        "type": "A4.Deployment",
        "version": "1.0"
      },
      "status": "proposed",
      "confidence": 0.69,
      "evidence": [
        "engine_rationale:shared terms ['engine', 'fraud'] between 'Fraud Engine' and 'Fraud Engine \u2014 production deployment'"
      ],
      "rationale": "shared terms ['engine', 'fraud'] between 'Fraud Engine' and 'Fraud Engine \u2014 production deployment'",
      "baseline_id": "ENGINE-RUN",
      "created_by": "baseline-name-overlap/0.5"
    }
  ]
}
