{
  "registry_version": "0.4.0",
  "metamodel_version": "0.5.0",
  "use_case": "C3",
  "mappings": [
    {
      "mapping_id": "TF-118",
      "source": {
        "id": "APP-LC",
        "type": "A3.ApplicationComponent",
        "version": "3.0"
      },
      "relationship": "DEPLOYED_AS",
      "target": {
        "id": "DEP-LC-PROD",
        "type": "A4.Deployment",
        "version": "1.0"
      },
      "perspective": "architecture",
      "status": "approved",
      "evidence": [
        "deployment_design:TF-DD-2026#prod"
      ],
      "rationale": "[S32] manifest",
      "baseline_id": "TF-BASE-2026-Q4",
      "reviewer_id": "jane.architect",
      "approved_at": "2026-10-22"
    },
    {
      "mapping_id": "TF-119",
      "source": {
        "id": "APP-DOC",
        "type": "A3.ApplicationComponent",
        "version": "3.0"
      },
      "relationship": "DEPLOYED_AS",
      "target": {
        "id": "DEP-DOC-PROD",
        "type": "A4.Deployment",
        "version": "1.0"
      },
      "perspective": "architecture",
      "status": "approved",
      "evidence": [
        "deployment_design:TF-DD-2026#prod"
      ],
      "rationale": "[S32] manifest",
      "baseline_id": "TF-BASE-2026-Q4",
      "reviewer_id": "jane.architect",
      "approved_at": "2026-10-22"
    },
    {
      "mapping_id": "TF-120",
      "source": {
        "id": "APP-LC",
        "type": "A3.ApplicationComponent",
        "version": "3.0"
      },
      "relationship": "DEPLOYED_ON",
      "target": {
        "id": "SYS-RUNTIME-TF",
        "type": "A4.SystemSoftware",
        "version": "1.30"
      },
      "perspective": "architecture",
      "status": "approved",
      "evidence": [
        "deployment_design:TF-DD-2026#prod"
      ],
      "rationale": "[S33] runtime hosts the component",
      "baseline_id": "TF-BASE-2026-Q4",
      "reviewer_id": "jane.architect",
      "approved_at": "2026-10-22"
    },
    {
      "mapping_id": "TF-121",
      "source": {
        "id": "APP-DOC",
        "type": "A3.ApplicationComponent",
        "version": "3.0"
      },
      "relationship": "DEPLOYED_ON",
      "target": {
        "id": "SYS-RUNTIME-TF",
        "type": "A4.SystemSoftware",
        "version": "1.30"
      },
      "perspective": "architecture",
      "status": "approved",
      "evidence": [
        "deployment_design:TF-DD-2026#prod"
      ],
      "rationale": "[S33] runtime hosts the component",
      "baseline_id": "TF-BASE-2026-Q4",
      "reviewer_id": "jane.architect",
      "approved_at": "2026-10-22"
    },
    {
      "mapping_id": "TF-122",
      "source": {
        "id": "APP-LC",
        "type": "A3.ApplicationComponent",
        "version": "3.0"
      },
      "relationship": "DEPLOYED_ON",
      "target": {
        "id": "NODE-TF-PROD",
        "type": "A4.Node",
        "version": "1.0"
      },
      "perspective": "architecture",
      "status": "approved",
      "evidence": [
        "deployment_design:TF-DD-2026#prod"
      ],
      "rationale": "[S34] node pool hosts the component (Node target — plan S34)",
      "baseline_id": "TF-BASE-2026-Q4",
      "reviewer_id": "jane.architect",
      "approved_at": "2026-10-22"
    },
    {
      "mapping_id": "TF-123",
      "source": {
        "id": "APP-DOC",
        "type": "A3.ApplicationComponent",
        "version": "3.0"
      },
      "relationship": "DEPLOYED_ON",
      "target": {
        "id": "NODE-TF-PROD",
        "type": "A4.Node",
        "version": "1.0"
      },
      "perspective": "architecture",
      "status": "approved",
      "evidence": [
        "deployment_design:TF-DD-2026#prod"
      ],
      "rationale": "[S34] node pool hosts the component (Node target — plan S34)",
      "baseline_id": "TF-BASE-2026-Q4",
      "reviewer_id": "jane.architect",
      "approved_at": "2026-10-22"
    },
    {
      "mapping_id": "TF-124",
      "source": {
        "id": "APP-DOC",
        "type": "A3.ApplicationComponent",
        "version": "3.0"
      },
      "relationship": "DEPLOYED_ON",
      "target": {
        "id": "DEV-SCAN-01",
        "type": "A4.Device",
        "version": "1.0"
      },
      "perspective": "architecture",
      "status": "approved",
      "evidence": [
        "deployment_design:TF-DD-2026#branch"
      ],
      "rationale": "[S35] the capture module runs on the appliance (Device target — plan S35)",
      "baseline_id": "TF-BASE-2026-Q4",
      "reviewer_id": "jane.architect",
      "approved_at": "2026-10-22"
    }
  ]
}
